<?xml version="1.0" encoding="UTF-8"?>
<xs:schema xmlns:xs="http://www.w3.org/2001/XMLSchema">

  <xs:element name="biblioteca">
    <xs:complexType>
      <xs:sequence>
        <xs:element name="libro" maxOccurs="unbounded">
          <xs:complexType>
            <xs:sequence>
              <xs:element name="titulo" type="xs:string"/>
              <xs:element name="autor" type="xs:string"/>
              <xs:element name="fecha_publicacion" type="xs:date"/>
              <xs:element name="paginas" type="xs:positiveInteger"/>
            </xs:sequence>
            <xs:attribute name="categoria" type="xs:string" use="required"/>
          </xs:complexType>
        </xs:element>
      </xs:sequence>
    </xs:complexType>
  </xs:element>

</xs:schema>